"Status","Start Time","Stop Time","Duration in ms","Parent Suite","Suite","Sub Suite","Test Class","Test Method","Name","Description"
"passed","Wed Jan 24 11:42:03 SAST 2024","Wed Jan 24 11:42:04 SAST 2024","640","chromium","home.spec.ts","Home","","","Verify Bushwise name and logo is visible using xpath selector",""
"passed","Wed Jan 24 11:41:59 SAST 2024","Wed Jan 24 11:42:01 SAST 2024","2078","chromium","home.spec.ts","Home","","","Open HomePage and verify title",""
"passed","Wed Jan 24 11:42:04 SAST 2024","Wed Jan 24 11:42:04 SAST 2024","820","chromium","home.spec.ts","Home","","","Verify text of all nav links",""
"passed","Wed Jan 24 11:42:01 SAST 2024","Wed Jan 24 11:42:02 SAST 2024","1123","chromium","home.spec.ts","Home","","","Click the Go into the wild button using CSS Selector",""
"passed","Wed Jan 24 11:42:02 SAST 2024","Wed Jan 24 11:42:03 SAST 2024","648","chromium","home.spec.ts","Home","","","Verify heading text is visible using text selector",""
